{
  "schema_version": "1.0",
  "feature": {
    "id": "FEATURE-0016",
    "slug": "adapter-boundary-and-executiontarget-qualification",
    "title": "Adapter Boundary and ExecutionTarget Qualification",
    "tier": "A",
    "phase": 2,
    "phase_branch": "phase2-reuse-first-paas-fabric-foundation",
    "feature_branch": "feature-0016-adapter-boundary-and-executiontarget-qualification",
    "feature_file": "docs/features/FEATURE-0016-adapter-boundary-and-executiontarget-qualification.md",
    "architecture": "docs/architecture/FEATURE-0016-adapter-boundary-and-executiontarget-qualification.md",
    "handoffs": [
      "docs/reviews/architecture-decision-handoffs/ADH-2026-058-feature-0016-adapter-and-executiontarget-executable-contract-closure.md",
      "docs/reviews/architecture-decision-handoffs/ADH-2026-060-feature-0016-maintenance-race-outcome-clarification.md",
      "docs/reviews/architecture-decision-handoffs/ADH-2026-061-feature-0016-maintenance-entry-link-clearing-correction.md",
      "docs/reviews/architecture-decision-handoffs/ADH-2026-062-feature-0016-task-scope-inventory-path-classification-correction.md",
      "docs/reviews/architecture-decision-handoffs/ADH-2026-063-feature-0016-create-phase-one-strict-classification-precedence-correction.md",
      "docs/reviews/architecture-decision-handoffs/ADH-2026-064-feature-0016-vs000-executiontarget-ownership-correction.md"
    ],
    "spec_path": ".kiro/specs/adapter-boundary-and-executiontarget-qualification"
  },
  "ownership": {
    "owned_resources": [
      "ExecutionTarget",
      "NormalizedTargetFactSet",
      "TargetQualificationResult"
    ],
    "previous_features": [
      {
        "id": "FEATURE-0011",
        "relationship": "reuses Reuse Assessment Standard governance contract",
        "context": {
          "requirements": [],
          "design": ["docs/features/FEATURE-0011-reuse-assessment-standard.md"]
        }
      },
      {
        "id": "FEATURE-0012",
        "relationship": "reuses Problem Details, ObjectMeta, TypedRef, Condition schemas, media semantics, and optimistic-concurrency conventions",
        "context": {
          "requirements": ["docs/features/FEATURE-0012-api-resource-naming-status-and-validation-standard.md"],
          "design": ["docs/architecture/api-resource-standard.md"]
        }
      },
      {
        "id": "FEATURE-0013",
        "relationship": "reuses AuditEvent atomic-publication semantics; does not redefine",
        "context": {
          "requirements": ["docs/features/FEATURE-0013-decision-object-and-auditevent-standard.md"],
          "design": ["docs/architecture/FEATURE-0013-decision-record-and-auditevent-standard.md"]
        }
      },
      {
        "id": "FEATURE-0015",
        "relationship": "read-only prior-feature authority for CloudProviderParticipation and InfrastructureStack; FEATURE-0016 does not modify FEATURE-0015",
        "context": {
          "requirements": [],
          "design": ["docs/architecture/FEATURE-0015-canonical-cloud-model-foundation.md"]
        }
      }
    ],
    "excluded_features": [
      {"id": "FEATURE-0017", "concepts": ["PolicyEvaluationRequest", "PolicyEvaluationResult", "PolicyEngineAdapter"]},
      {"id": "FEATURE-0019", "concepts": ["SovereigntyProfile", "SovereigntyFactSet", "EvidenceRecord"]},
      {"id": "FEATURE-0022", "concepts": ["ServiceRegion", "spec.executionTargetRefs", "status.availability on ServiceRegion"]},
      {"id": "FEATURE-0023", "concepts": ["DecisionProfiles", "ServicePlacement", "PlacementDecision", "customer target projection"]},
      {"id": "FEATURE-0024", "concepts": ["PluginExecution", "ServiceDeploymentPlan", "real realization/plugin taxonomy", "Crossplane dependency"]}
    ],
    "forbidden_concepts": [
      "ResourcePool",
      "ProviderCapability",
      "generic Provider as combined owner/operator",
      "target subtype",
      "persisted status.availability on ExecutionTarget",
      "Draining",
      "publicly projected Qualifying",
      "adapterAuthorityRef",
      "SecretRef extension",
      "real adapter",
      "real external call",
      "Crossplane dependency",
      "placement",
      "provisioning",
      "plugin execution",
      "customer IaaS exposure"
    ]
  },
  "context": {
    "always": [
      "AGENTS.md",
      "docs/foundation/constitution.md",
      "docs/decisions/DECISION_INDEX.md",
      "docs/glossary.md",
      "docs/engineering/ai-context-loading-standard.md",
      "docs/context/CURRENT_ARCHITECTURE_BASELINE.md",
      "docs/phase2/PHASE2R_REBASELINE.md",
      "docs/architecture/vertical-slices/VS-000-contract-specification.md",
      "docs/architecture/vertical-slices/VS-000-contract-registry.yaml",
      ".kiro/steering/slice0-contract.md"
    ],
    "stages": {
      "requirements": [],
      "design": [
        "docs/engineering/go-coding-guardrails.md",
        "docs/architecture/controller-reconciliation-model.md",
        "docs/architecture/observability-and-audit-baseline.md",
        "docs/architecture/adapter-boundary-model.md"
      ],
      "tasks": [
        "docs/engineering/go-coding-guardrails.md",
        "docs/engineering/go-observability-standard.md"
      ],
      "implementation": [
        "docs/engineering/go-coding-guardrails.md",
        "docs/engineering/go-version-standard.md",
        "docs/engineering/go-observability-standard.md"
      ],
      "review": [
        "docs/governance/REVIEW_GATES.md"
      ]
    },
    "budgets": {
      "requirements": 450000,
      "design": 800000,
      "tasks": 700000,
      "implementation": 850000,
      "review": 750000
    }
  },
  "guardrails": {
    "kiro": {
      "writable_by_stage": {
        "requirements": [".kiro/specs/adapter-boundary-and-executiontarget-qualification/requirements.md"],
        "design": [".kiro/specs/adapter-boundary-and-executiontarget-qualification/design.md"],
        "tasks": [".kiro/specs/adapter-boundary-and-executiontarget-qualification/tasks.md"]
      },
      "forbidden_outputs": ["internal/", "cmd/", "api/schemas/", "tests/"]
    },
    "cursor": {
      "go_context": [
        "docs/engineering/go-coding-guardrails.md",
        "docs/engineering/go-version-standard.md",
        "docs/engineering/go-observability-standard.md"
      ],
      "require_complete_receipt": true,
      "verify_commands": ["make fmt", "make vet", "make test"]
    },
    "stop_conditions": [
      "ARCHITECTURE_DECISION_REQUIRED",
      "REQUIREMENT_CLARIFICATION_REQUIRED",
      "BOUNDARY_CHANGE_REQUIRED",
      "DEPENDENCY_APPROVAL_REQUIRED",
      "SECURITY_REVIEW_REQUIRED"
    ]
  },
  "execution": {
    "human_gates": ["architecture", "executable_plan", "final"],
    "tasks_per_run": 2,
    "require_clean_tree": true,
    "commit_per_task": true,
    "max_stage_revisions": 2
  },
  "models": {
    "architecture": "architecture",
    "requirements": "requirements",
    "design": "design",
    "tasks": "tasks",
    "review": "review",
    "implementation": "implementation",
    "mechanical": "deterministic_first"
  },
  "closeout": {
    "mode": "prepare_only",
    "metadata_targets": [
      "docs/features/FEATURE_INDEX.md",
      "docs/context/CURRENT_PHASE_CONTEXT.md",
      "docs/context/CURRENT_ARCHITECTURE_BASELINE.md",
      "docs/context/CURRENT_DECISION_SUMMARY.md",
      "docs/traceability/FEATURE_TRACEABILITY_MATRIX.md",
      "docs/traceability/VS-000_CONTRACT_TRACEABILITY_MATRIX.md"
    ],
    "commit": false,
    "push": false
  }
}
