{
  "schema_version": "1.0",
  "feature": {
    "id": "FEATURE-0015",
    "slug": "canonical-cloud-model-and-alpha-migration",
    "title": "Canonical Cloud Model and Alpha Migration Foundation",
    "tier": "A",
    "phase": 2,
    "phase_branch": "phase2-reuse-first-paas-fabric-foundation",
    "feature_branch": "feature-0015-canonical-cloud-model-and-alpha-migration",
    "feature_file": "docs/features/FEATURE-0015-canonical-cloud-model-and-alpha-migration-foundation.md",
    "architecture": "docs/architecture/FEATURE-0015-canonical-cloud-model-and-alpha-migration-foundation.md",
    "handoffs": [
      "docs/reviews/architecture-decision-handoffs/canonical-model/ADH-2026-020-cloudprovider-identity-and-scope.md",
      "docs/reviews/architecture-decision-handoffs/canonical-model/ADH-2026-024-geography-and-sovereignty.md",
      "docs/reviews/architecture-decision-handoffs/canonical-model/ADH-2026-025-executiontarget-no-resourcepool.md",
      "docs/reviews/architecture-decision-handoffs/canonical-model/ADH-2026-037-cloudplatform-provider-participation-installation-isolation.md",
      "docs/reviews/architecture-decision-handoffs/canonical-model/ADH-2026-041-coordinated-alpha-migration-no-dual-authority.md",
      "docs/reviews/architecture-decision-handoffs/ADH-2026-042-final-canonical-model-adoption.md",
      "docs/reviews/architecture-decision-handoffs/ADH-2026-043-feature-0015-architecture-readiness-closure.md"
    ],
    "spec_path": ".kiro/specs/canonical-cloud-model-and-alpha-migration"
  },
  "ownership": {
    "owned_resources": [
      "CloudPlatform",
      "CloudProvider",
      "CloudProviderParticipation",
      "HostingLocation",
      "Datacenter",
      "FaultDomain",
      "InfrastructureStack",
      "ExecutionTarget-identity",
      "CanonicalMigrationPlan",
      "CanonicalMigrationRecord"
    ],
    "previous_features": [
      {
        "id": "FEATURE-0011",
        "relationship": "reuses Reuse Assessment Standard governance contract",
        "context": {
          "requirements": ["docs/features/FEATURE-0011-reuse-assessment-standard.md"],
          "design": ["docs/features/FEATURE-0011-reuse-assessment-standard.md"]
        }
      },
      {
        "id": "FEATURE-0012",
        "relationship": "reuses Problem Details, ObjectMeta, TypedRef, Condition schemas and API resource standard",
        "context": {
          "requirements": ["docs/features/FEATURE-0012-api-resource-naming-status-and-validation-standard.md"],
          "design": ["docs/architecture/api-resource-standard.md"]
        }
      },
      {
        "id": "FEATURE-0013",
        "relationship": "reuses DecisionRecord and AuditEvent schemas; does not redefine",
        "context": {
          "requirements": [],
          "design": ["docs/architecture/FEATURE-0013-decision-record-and-auditevent-standard.md"]
        }
      },
      {
        "id": "FEATURE-0014",
        "relationship": "legacy migration input; alpha Provider model superseded by current canonical baseline; do NOT adopt ResourcePool/ProviderCapability",
        "context": {
          "requirements": ["docs/features/FEATURE-0014-provider-neutral-resource-model.md"],
          "design": ["docs/architecture/provider-neutral-resource-model.md"]
        }
      }
    ],
    "excluded_features": [
      {"id": "FEATURE-0016", "concepts": ["ExecutionTarget qualification", "ExecutionTarget availability", "NormalizedTargetFactSet", "TargetQualificationResult", "maintenanceEpoch writes"]},
      {"id": "FEATURE-0017", "concepts": ["PolicyEvaluationRequest", "PolicyEvaluationResult", "PolicyEngineAdapter"]},
      {"id": "FEATURE-0018", "concepts": ["GovernanceProfile", "Membership", "RoleDefinition", "RoleAssignment"]},
      {"id": "FEATURE-0019", "concepts": ["SovereigntyProfile", "SovereigntyFactSet", "EvidenceRecord"]},
      {"id": "FEATURE-0020", "concepts": ["ProfileAssignment", "EffectiveGovernanceContext"]},
      {"id": "FEATURE-0021", "concepts": ["CloudEnrollment", "EntitlementPackage", "ServiceEntitlement", "QuotaPolicy", "provider-selection intent evaluation"]},
      {"id": "FEATURE-0022", "concepts": ["ServiceTypeDefinition", "ServiceOffering", "ServicePlan", "ServiceRuntimeProfile", "ServiceRequirementSet", "ServiceRegion"]},
      {"id": "FEATURE-0023", "concepts": ["DecisionProfiles", "ServicePlacement", "PlacementDecision"]},
      {"id": "FEATURE-0024", "concepts": ["PluginExecution", "ServiceDeploymentPlan", "fake harness"]},
      {"id": "FEATURE-0025", "concepts": ["DecisionOperationContext", "AI-readable projection"]},
      {"id": "FEATURE-0026", "concepts": ["Slice 0 integration demo", "cross-feature orchestration"]}
    ],
    "forbidden_concepts": [
      "ResourcePool",
      "ProviderCapability",
      "generic Provider as combined owner/operator",
      "ServiceClass as canonical catalog",
      "EffectivePolicyContext",
      "provider-neutral (as adjective)",
      "six-scope authority",
      "SovrunnInstallation"
    ]
  },
  "context": {
    "always": [
      "AGENTS.md",
      "docs/foundation/constitution.md",
      "docs/decisions/DECISION_INDEX.md",
      "docs/glossary.md",
      "docs/engineering/ai-context-loading-standard.md",
      "docs/context/CURRENT_ARCHITECTURE_BASELINE.md",
      "docs/phase2/PHASE2R_REBASELINE.md",
      "docs/phase2/PHASE2_FEATURE_SEQUENCE.md",
      "docs/architecture/vertical-slices/VS-000-contract-specification.md",
      "docs/architecture/vertical-slices/VS-000-contract-registry.yaml",
      "docs/traceability/VS-000_CONTRACT_TRACEABILITY_MATRIX.md",
      ".kiro/steering/slice0-contract.md"
    ],
    "stages": {
      "requirements": [
        "docs/resource-specs/RESOURCE_MODEL_PHASE1.md",
        "docs/api/API_CONTRACT_PHASE1.md"
      ],
      "design": [
        "docs/engineering/go-coding-guardrails.md",
        "docs/architecture/controller-reconciliation-model.md",
        "docs/architecture/observability-and-audit-baseline.md"
      ],
      "tasks": [
        "docs/engineering/go-coding-guardrails.md",
        "docs/engineering/go-observability-standard.md"
      ],
      "implementation": [
        "docs/engineering/go-coding-guardrails.md",
        "docs/engineering/go-version-standard.md",
        "docs/engineering/go-observability-standard.md"
      ],
      "review": [
        "docs/governance/REVIEW_GATES.md"
      ]
    },
    "budgets": {
      "requirements": 325000,
      "design": 360000,
      "tasks": 420000,
      "implementation": 420000,
      "review": 500000
    }
  },
  "guardrails": {
    "kiro": {
      "writable_by_stage": {
        "requirements": [".kiro/specs/canonical-cloud-model-and-alpha-migration/requirements.md"],
        "design": [".kiro/specs/canonical-cloud-model-and-alpha-migration/design.md"],
        "tasks": [".kiro/specs/canonical-cloud-model-and-alpha-migration/tasks.md"]
      },
      "forbidden_outputs": ["internal/", "cmd/", "api/schemas/", "tests/"]
    },
    "cursor": {
      "go_context": [
        "docs/engineering/go-coding-guardrails.md",
        "docs/engineering/go-version-standard.md",
        "docs/engineering/go-observability-standard.md"
      ],
      "require_complete_receipt": true,
      "verify_commands": ["make fmt", "make vet", "make test"]
    },
    "stop_conditions": [
      "ARCHITECTURE_DECISION_REQUIRED",
      "REQUIREMENT_CLARIFICATION_REQUIRED",
      "BOUNDARY_CHANGE_REQUIRED",
      "DEPENDENCY_APPROVAL_REQUIRED",
      "SECURITY_REVIEW_REQUIRED"
    ]
  },
  "execution": {
    "human_gates": ["architecture", "executable_plan", "final"],
    "tasks_per_run": 2,
    "require_clean_tree": true,
    "commit_per_task": true,
    "max_stage_revisions": 2
  },
  "models": {
    "architecture": "architecture",
    "requirements": "requirements",
    "design": "design",
    "tasks": "tasks",
    "review": "review",
    "implementation": "implementation",
    "mechanical": "deterministic_first"
  },
  "closeout": {
    "mode": "prepare_only",
    "metadata_targets": [
      "docs/features/FEATURE_INDEX.md",
      "docs/context/CURRENT_PHASE_CONTEXT.md",
      "docs/context/CURRENT_ARCHITECTURE_BASELINE.md",
      "docs/context/CURRENT_DECISION_SUMMARY.md",
      "docs/traceability/FEATURE_TRACEABILITY_MATRIX.md",
      "docs/traceability/VS-000_CONTRACT_TRACEABILITY_MATRIX.md"
    ],
    "commit": false,
    "push": false
  }
}
